unique_id,type,group1_id,group2_id,date,description,group1_name,group2_name
1039,riv,499,225,1982-05-00,"In mid-1982, clashes between LTTE and PLOTE members begin. The two groups remain rivals until the defeat of the LTTE in 2009.",People's Liberation Organization of Tamil Eelam,Liberation Tigers of Tamil Elam
1041,all,501,511,1987-07-00,The ENDLF collaborated with the IPKF after their arrival in Sri Lanka in mid-1987.,Eelam National Democratic Liberation Front,Indian Peace Keeping Force
1045,all,511,509,1987-06-00,"As a result of the Indo-Sri Lankan Accord of July 1987, the Sri Lankan government agreed to send forces to Sri Lanka to help Sri Lankan forces disarm Tamil militant groups and cease hostilities between the two.",Indian Peace Keeping Force,Democratic Socialist Republic of Sri Lanka 
1047,all,495,509,2006-00-00,"In 2006, Colonel Karuna allied himself and his faction with the Sri Lankan government, delivering a serious blow to the LTTE.",Colonel Karuna Faction,Democratic Socialist Republic of Sri Lanka 
1049,spl,513,505,1980-00-00,A breakaway faction of EROS formed the EPRLF in 1980 because of growing disagreements between EROS\' leadership in London and in Jaffna.,Eelam Revolutionary Organization of Students,Eelam People's Revolutionary Liberation Front
1051,spl,513,225,1990-00-00,"In 1990, the majority of EROS members, along with former EROS leader V. Balakumaran, left the group to join the LTTE because of disagreements over the use of violence and continued military support of the LTTE.",Eelam Revolutionary Organization of Students,Liberation Tigers of Tamil Elam
1053,all,225,515,1983-00-00,"In 1983, RAW provides logistical and financial support to the LTTE.",Liberation Tigers of Tamil Elam,Research and Analysis Wing 
1055,riv,515,225,1986-00-00,RAW withdraws its support for the LTTE as it grows more radical and makes ties with separatist groups in the Indian state of Tamil Nadu. ,Research and Analysis Wing ,Liberation Tigers of Tamil Elam
1057,riv,225,511,1987-06-00,"The LTTE clashes with the IPKF when they arrive in Sri Lanka as mandated by the Indo-Sri Lankan Accord, eventually leading to the IPKF\'s withdrawal in 1990.",Liberation Tigers of Tamil Elam,Indian Peace Keeping Force
1059,all,499,515,1980-00-00,"In the early 1980s, RAW supported PLOTE and other Tamil militant groups.",People's Liberation Organization of Tamil Eelam,Research and Analysis Wing 
1061,riv,499,515,1985-00-00,"In 1985, RAW signaled their withdrawal of support for PLOTE when they allowed Indian customs officials to seize several containers of military equipment being sent to PLOTE through India.",People's Liberation Organization of Tamil Eelam,Research and Analysis Wing 
1063,spl,503,517,1982-00-00,"In 1982, Oberoi Devan and his supporters in the Tamil Eelam Liberation Army (TELA) defected from Tamil Eelam Liberation Organization (TELO). TELA was the former military wing of TELO.",Tamil Eelam Liberation Organization ,Tamil Eelam Liberation Army 
1065,all,517,499,1983-08-00,"Shortly after its split from TELO, the TELA allied itself with LTTE\'s rival, PLOTE. In August 1983, TELA\'s leader Oberoi Devan was assassinated by LTTE members.",Tamil Eelam Liberation Army ,People's Liberation Organization of Tamil Eelam
1067,all,513,519,1984-04-00,"In April 1984, EROS, EPRLF, and TELO joined forces to form an umbrella organization known as the Eelam National Liberation Front (ENLF).",Eelam Revolutionary Organization of Students,Eelam National Liberation Front
1069,all,503,519,1984-04-00,"In April 1984, EROS, EPRLF, and TELO joined forces to form an umbrella organization known as the Eelam National Liberation Front (ENLF).",Tamil Eelam Liberation Organization ,Eelam National Liberation Front
1071,all,505,519,1984-04-00,"In April 1984, EROS, EPRLF, and TELO joined forces to form an umbrella organization known as the Eelam National Liberation Front (ENLF).",Eelam People's Revolutionary Liberation Front,Eelam National Liberation Front
1073,all,225,519,1985-08-00,"In August 1985, LTTE formally joins the ENLF, in preparation for the Thimpu peace talks with the Sri Lankan government.",Liberation Tigers of Tamil Elam,Eelam National Liberation Front
1075,all,513,515,1983-07-00,"After clashes between Sri Lankan government forces and Tamil militants began to intensify in 1983, EROS established close ties with RAW 1983  EROS established close ties with RAW. Several EROS members were then trained at Indian training camps.",Eelam Revolutionary Organization of Students,Research and Analysis Wing 
1077,all,513,225,1986-00-00,"In 1986, the LTTE and EROS agree to use EROS training camps in Vavuniya as their main military training site.",Eelam Revolutionary Organization of Students,Liberation Tigers of Tamil Elam
1079,all,503,515,1983-01-00,"TELO is one of the first Tamil militant groups to develop close relations with RAW. In 1983, RAW invites 350 cadres to train in India.",Tamil Eelam Liberation Organization ,Research and Analysis Wing 
1081,all,503,511,1987-00-00,"The IPKF attempts to revive TELO as a militant group to fight against the LTTE. However, TELO was constantly under LTTE attack and was never able to re-emerge as a militant group.  ",Tamil Eelam Liberation Organization ,Indian Peace Keeping Force
1083,all,503,225,1977-10-00,LTTE and TELO enter into a coordinating alliance against Sri Lankan government forces.,Tamil Eelam Liberation Organization ,Liberation Tigers of Tamil Elam
1085,all,503,225,1978-00-00,LTTE and TELO enter into a coordinating alliance against Sri Lankan government forces. ,Tamil Eelam Liberation Organization ,Liberation Tigers of Tamil Elam
1087,all,501,515,1987-00-00,The ENDLF was created in 1987 by the merger of various PLOTE and EPRLF splinter groups. This merger was supported and facilitated by RAW.,Eelam National Democratic Liberation Front,Research and Analysis Wing 
1089,aff,255,521,2013-11-00,The leadership of Jaish al-Muhajireen wal Ansar has sworn a loyalty oath to the Caucasus Emirate and many fighters are former members. ,Caucasus Emirate,Jaish al-Muhajireen wal Ansar
1843,aff,525,537,2011-11-00,"Suqour al-Sham was affiliated with the Free Syrian Army (FSA) in 2011, and became a founding a member of the FSA linked Syrian Islamic Liberation Front (SILF) umbrella organization in 2012. Despite its close FSA ties, Suqour al-Sham did not take orders from the FSAs Syrian National Council, and began to distance itself from the FSA when it joined the Islamic Coalition on September 23, 2013.",Suqour al-Sham,Free Syrian Army
1093,aff,21,493,2012-02-00,"Jabhat al-Nusra was formed in late 2011, when Al Qaeda in Iraq (AQI) emir Abu Bakr al-Baghdadi sent AQI operative Abu Muhammad al-Julani to Syria to organize jihadist cells in the region.",Al Qaeda,Hay'at Tahrir al-Sham (Formerly Jabhat al-Nusra)
1863,riv,659,1,2015-05-00,Al Fawj Al Awl began fighting the Islamic State in the Aleppo governorate.,Al-Fawj Al-Awl,The Islamic State
1865,riv,661,1,2011-03-00,Jaysh al Sanadeed began targeting the Islamic State.,Jaysh al-Sanadeed,The Islamic State
1867,riv,523,1,2014-04-00,"After a series of small skirmishes between Ahrar al-Sham and the Islamic State (IS), Ahrar al-Sham and its allies, including Jabhat al-Nusra, began to target the Islamic State. Ahrar al-Sham and its allies initially drove IS out of the city of Raqqa.",Ahrar al-Sham,The Islamic State
1869,riv,645,1,2014-09-00,"The Southern Front began opposing the Islamic State (IS), and joined larger opposition campaigns against IS in the Daraa governorate.",The Southern Front ,The Islamic State
1927,riv,629,493,2015-07-00,"Kataib Sayyid al-Shuhada (KSS) participated in the Assad Regimes offensive in the southern Syrian governorates, namely in Daraa and Quneitra. KSS fought alongside Assad Regime troops, Hezbollah, the Iranian Revolutionary Guard Corps and other Shiite militias against elements of the Free Syrian Army and Jabhat al-Nusra.",Kataib Sayyid al-Shuhada,Hay'at Tahrir al-Sham (Formerly Jabhat al-Nusra)
1913,all,545,21,2013-00-00,"Although ASL publicly denies a relationship with Al Qaeda (AQ), the group has released statements in support of AQ and its leaders in the past and allegedly acts as an AQ ally.  ASLs training camps have supplied fighters to Jabhat Fatah al Sham, the group formerly known as Al-Nusra, AQs Syria branch. ",Ansar al-Shariah (Libya),Al Qaeda
1917,all,545,613,2014-00-00,ASL was also known to coordinate attacks with Al Murabitoun before Al Murabitoun merged into AQIM in 2015.,Ansar al-Shariah (Libya),Al Murabitoun
1919,all,545,611,2013-01-00,ASLs Libya-based camps  trained militants from the Those Who Sign in Blood Brigade for the attack on In Amenas gas complex. ,Ansar al-Shariah (Libya),The Those Who Sign in Blood Brigade
1811,all,527,493,2/1/13,"Liwa al-Tawhid and Jabhat al-Nusra (Al-Nusra) cooperated with the Nasser Salahuddin Brigade, Dera al-Assima, and Liwa al-Habib al Mustafa in a series of attacks against Syrian army units and outposts in the Damascus countryside. According to Al-Nusra, the militants destroyed several tanks and killed over 150 Syrian soldiers.",Liwa al-Tawhid,Hay'at Tahrir al-Sham (Formerly Jabhat al-Nusra)
1137,all,493,523,11/1/12,Ahrar al-Sham and Jabhat al-Nusra first cooperated in an attack the International Center for Agricultural Research in the Dry Areas.,Hay'at Tahrir al-Sham (Formerly Jabhat al-Nusra),Ahrar al-Sham
1113,all,541,537,2014-01-00,The Islamic Front and the Free Syrian Army work together in clashes with ISIS in Northern Syria.,Islamic Front,Free Syrian Army
1117,riv,541,1,2014-01-00,The Islamic Front and the FSA clash with ISIS in Northern Syria.,Islamic Front,The Islamic State
1923,riv,629,537,2015-09-00,"Kataib Sayyid al-Shuhada (KSS) participated in the Assad Regimes offensive in the southern Syrian governorates, namely in Daraa and Quneitra. KSS fought alongside Assad Regime troops, Hezbollah, the Iranian Revolutionary Guard Corps and other Shiite militias against elements of the Free Syrian Army and Jabhat al-Nusra.",Kataib Sayyid al-Shuhada,Free Syrian Army
1921,riv,143,537,2016-05-00,Asa'ib Ahl al-Haq began targeting the Free Syrian Army in the Aleppo governorate.,Asa'ib Ahl al-Haq,Free Syrian Army
1823,all,659,523,2016-02-00,"Al Fawj al-Awl joined the Jaysh Halab operations room, where it began cooperating with Ahrar al-Sham.",Al-Fawj Al-Awl,Ahrar al-Sham
1821,all,523,1,2013-08-00,Ahrar al-Sham and the Islamic State coordinated an attack on Alawite villages in the Latakia governorate that killed 190 civilians.,Ahrar al-Sham,The Islamic State
1371,all,1,5,2004-00-00,"In the years immediately following the 2003 U.S. invasion, AQI and IAI worked closely with one another to combat U.S. forces. One of the founders of the IAI, Sheikh Ahmed al-Dabash, claimed to be like a brother to Abu Musab al-Zarqawi, the leader of AQI.",The Islamic State,Islamic Army in Iraq
1853,riv,535,655,11/1/13,"Ahrar al-Sham, the Islamic State, and The Kurdish Islamic Front began targeting the YPG.",Kurdish Islamic Front,Peoples Protection Units
1855,riv,1,655,10/15/13,"Ahrar al-Sham, the Islamic State, and The Kurdish Islamic Front began targeting the YPG.",The Islamic State,Peoples Protection Units
1857,riv,523,655,9/1/13,"Ahrar al-Sham, the Islamic State, and The Kurdish Islamic Front began targeting the YPG.",Ahrar al-Sham,Peoples Protection Units
1859,riv,655,493,7/1/13,The YPG began targeting Jabhat al-Nusra and won the battle of Ras al-Ayn.,Peoples Protection Units,Hay'at Tahrir al-Sham (Formerly Jabhat al-Nusra)
1861,riv,533,655,4/7/16,Jaysh al-Islam began targeting the YPG and other Kurdish forces in the Aleppo governorate.,Jaysh al-Islam,Peoples Protection Units
1805,all,537,493,2012-08-00,The Free Syrian Army (FSA) began cooperating with Jabhat al-Nusra (Al-Nusra). Al-Nusra intially avoided targeting civilian areas and minimized collateral damage in order to maintain ties with the FSA.,Free Syrian Army,Hay'at Tahrir al-Sham (Formerly Jabhat al-Nusra)
1909,riv,619,493,2016-01-00,Harakat al-Nujaba targeted Jabhat al-Nusra in an offensive in the Aleppo governorate.,Harakat al-Nujaba,Hay'at Tahrir al-Sham (Formerly Jabhat al-Nusra)
1825,all,659,493,2015-08-00,Al Fawj al-Awl conducted military exercises with Jabhat al-Nusra.,Al-Fawj Al-Awl,Hay'at Tahrir al-Sham (Formerly Jabhat al-Nusra)
1827,all,657,523,2016-02-00,Harakat Nour al-Din al-Zenki began coordinating attacks with Ahrar al-Sham as part of the Jaysh Halab operations room.,Harakat Nour al-Din al-Zenki,Ahrar al-Sham
1829,all,657,493,6/1/12,Harakat Nour al-Din al-Zenki began cooperating with Jabhat al-Nusra.,Harakat Nour al-Din al-Zenki,Hay'at Tahrir al-Sham (Formerly Jabhat al-Nusra)
1831,all,653,493,2012-09-00,"Liwa al-Islam began cooperating with Jabhat al-Nusra during ""Operation Epic in the Capital of Omayyads.""",Liwa al-Islam,Hay'at Tahrir al-Sham (Formerly Jabhat al-Nusra)
1833,all,647,523,7/18/15,The Levantine Front began cooperating with Ahrar al-Sham as part of the Fatah Halab joint operations room.,The Levantine Front ,Ahrar al-Sham
1839,all,647,493,2015-06-00,The Levantine Front began cooperating with Jabhat al-Nusra as part of the Fatah Halab joint operations room.,The Levantine Front ,Hay'at Tahrir al-Sham (Formerly Jabhat al-Nusra)
1841,all,661,655,2015-02-00,Jaysh al-Sanadeed and the YPG began coordinating attacks against the Islamic State in the Hassakah governorate.,Jaysh al-Sanadeed,Peoples Protection Units
1795,mer,653,533,9/29/13,"Saudi Arabia facilitated a merger of about fifty Damascus-based opposition groups, including Liwa al-Islam, to create a new opposition group known as Jaysh al-Islam.",Liwa al-Islam,Jaysh al-Islam
1797,mer,525,523,2015-04-00,"Suqour al-Sham merged into Ahrar al-Sham. Suqour al-Sham's former leader, Ahmad Abu Eissa, became a deputy responsible for Ahrar al-Shams political affairs.",Suqour al-Sham,Ahrar al-Sham
1799,mer,529,523,12/1/14,Liwa al-Haqq merged into Ahrar al-Sham.,Liwa al-Haqq,Ahrar al-Sham
1801,mer,535,523,12/1/14,The Kurdish Islamic Front merged into Ahrar al-Sham.,Kurdish Islamic Front,Ahrar al-Sham
1911,all,547,545,2012-00-00,"AST and Ansar al-Shariah in Libya (ASL) reportedly have operational, financial and logistical links, but the extent of their relationship is unclear. ASL has allegedly sold weapons to AST.  ",Ansar al-Shariah (Tunisia),Ansar al-Shariah (Libya)
1845,aff,537,527,2012-07-00,"Liwa al-Tawhid initially pledged allegiance to the Free Syrian Army (FSA). However, Liwa al-Tawhid often acted independently of FSA-affiliated groups, and it began to distance itself from the FSA on September 29, 2013 by joining the Islamic Coalition, a political group that called for opposition to the Assad Regime to be run only by groups fighting inside Syria and opposed the National Coalition for Syrian Revolutionary and Opposition Forces.",Free Syrian Army,Liwa al-Tawhid
1847,aff,529,537,2012-11-00,"Liwa al-Haqq was initially affiliated with the Free Syrian Army (FSA). However, it began to distance itself from the FSA on September 23, 2013 by joining the Islamic Coalition, a political group that called for the implementation of Shariah in Syria and the opposition to the Assad Regime to be run only by groups fighting inside Syria.",Liwa al-Haqq,Free Syrian Army
1849,aff,653,537,2011-09-00,"Liwa al-Islam was initially affiliated with the Free Syrian Army (FSA). However, the group began to distance itself from the FSA in 2013 when Liwa al-Islam joined the Islamic Coalition, a political group that called for the implementation of Shariah law in Syria, and for the opposition to the Assad Regime to be run only by groups fighting inside Syria.",Liwa al-Islam,Free Syrian Army
1813,all,527,1,2013-11-00,Liwa al-Tawhid cooperated with the Islamic State to fight the Kurdish Peoples Protection Units in late 2013.,Liwa al-Tawhid,The Islamic State
1815,all,531,493,2014-05-00,Ansar al-Sham fought alongside Jabhat al-Nusra and Ahrar al-Sham during the 2014 Latakia Offensive.,Ansar al-Sham,Hay'at Tahrir al-Sham (Formerly Jabhat al-Nusra)
1817,all,531,523,2014-06-00,Ansar al-Sham fought alongside Jabhat al-Nusra and Ahrar al-Sham during the 2014 Latakia Offensive.,Ansar al-Sham,Ahrar al-Sham
1155,all,493,525,2013-01-00,"A number of opposition groups including Jabhat al-Nusra, Ahrar al-Sham, and Suqour al-Sham coordinated an attack to overtake the Assad Regime's air base in Taftanaz after beseiging the base for several months. The opposition groups eventually overtook Taftanaz, and seized helicopters, heavy weapons, and ammunition.",Hay'at Tahrir al-Sham (Formerly Jabhat al-Nusra),Suqour al-Sham
1819,all,645,493,2014-12-00,"The Southern Front and Jabhat al-Nusra (Al-Nusra) became allies and captured the town of Tel al-Haraa. Though the Southern Front officially stopped cooperating with Al-Nusra in April 2015, the groups still coordinated attacks in later battles.",The Southern Front ,Hay'at Tahrir al-Sham (Formerly Jabhat al-Nusra)
1157,all,523,525,2013-01-00," A number of opposition groups including Jabhat al-Nusra, Ahrar al-Sham, and Suqour al-Sham coordinated an attack to overtake the Assad Regime's air base in Taftanaz after beseiging the base for several months. The opposition groups eventually overtook Taftanaz, and seized helicopters, heavy weapons, and ammunition.",Ahrar al-Sham,Suqour al-Sham
1809,all,527,523,2013-03-00,"Liwa al-Tawhid participated in a joint offensive with multiple opposition groups, including Jabhat al-Nusra and Ahrar al-Sham, against Assad Regime military camps in the Idlib countryside.",Liwa al-Tawhid,Ahrar al-Sham
1871,riv,533,1,2013-10-00,"Jaysh al-Islam has opposed the Islamic State (IS) since 2013, and referred to IS as enemy number one of the Syrian revolution.",Jaysh al-Islam,The Islamic State
1873,riv,523,81,2013-05-00,Ahrar al-Sham began opposing Hezbollah in 2013 after Hezbollah announced its involvement in the Syrian conflict. The groups still target each other today despite two ceasefires in 2015.,Ahrar al-Sham,Hezbollah
1877,riv,529,81,2013-04-00,"Hezbollah began conducting operations with the Syrian army around al-Qusayr in March 2013. In May 2013, Hezbollah and the Syrian army launched an offensive against local opposition groups, and forced Jabhat al-Nusra, Liwa al-Haqq, and other insurgents out of the town of al-Qusayr.",Liwa al-Haqq,Hezbollah
1881,riv,527,655,12/15/13,Liwa al-Tawhid cooperated with the Islamic State to fight the Kurdish Peoples Protection Units in late 2013.,Liwa al-Tawhid,Peoples Protection Units
1885,riv,527,1,2014-07-00,"Clashes erupted between the Islamic State (IS) and Liwa al-Tawhid when Liwa al-Tawhid drove IS out of the city of Aleppo. In response to growing hostility with Liwa al-Tawhid and other militant groups, IS began targeting the leaders of opposition groups and killed prominent Liwa al-Tawhid member Adnan Bakour.",Liwa al-Tawhid,The Islamic State
1887,riv,525,1,1/3/14,"Suqour al-Sham began targeting the Islamic State on January 3, 2014.",Suqour al-Sham,The Islamic State
1889,riv,493,81,2014-08-00,"Jabaht al-Nusra began targeting Hezbollah with a suicide bombing in Bekaa Valley in Lebanon, near the boarder with Syria. The attack killed four people, including a local Hezbollah leader. ",Hay'at Tahrir al-Sham (Formerly Jabhat al-Nusra),Hezbollah
1891,riv,81,1,2014-01-00,"The Islamic State (IS) conducted a suicide bombing at Hezbollah's headquarters in Beirut, marking the third retaliatory attack on Lebanese soil for Hezbollah's support for the regime, and the first such attack carried out by IS.",Hezbollah,The Islamic State
1893,riv,1,537,2013-06-00,The Islamic State (IS) killed FSA leader Kamal Hamami after he ordered an IS soldier to take down a checkpoint.,The Islamic State,Free Syrian Army
1895,riv,493,1,2014-03-00,"Jabhat al-Nusra began targeting the Islamic State (IS), and coordinated with Ahrar al-Sham, Islamic Front units, and battalions from the Supreme Military Council to drive IS out of Raqqa. IS retook Raqqa in July 2014.",Hay'at Tahrir al-Sham (Formerly Jabhat al-Nusra),The Islamic State
1897,riv,647,1,2015-02-00,The Levantine Front was founded to counter the Islamic State's advances in the Aleppo governorate.,The Levantine Front ,The Islamic State
1899,riv,649,1,2014-10-00,The Ajnad al-Sham Islamic Union began fighting the Islamic State in the Damascus governorate.,The Ajnad al-Sham Islamic Union,The Islamic State
1901,riv,493,537,2014-11-00,Jabhat al-Nusra seized several villages from the Free Syrian Army in the Idlib governorate.,Hay'at Tahrir al-Sham (Formerly Jabhat al-Nusra),Free Syrian Army
1903,spl,21,493,7/28/16,Jabhat al-Nusra leader Abu-Muhammad al-Julani announced that the organization had ended its affiliation with Al Qaeda and had renamed itself Jabhat Fatah al-Sham (The Front for the Conquest of the Levant). Al Qaeda's central command sanctioned Fatah al-Sham's split.,Al Qaeda,Hay'at Tahrir al-Sham (Formerly Jabhat al-Nusra)
1907,riv,361,537,2016-03-00,Kata'ib Hezbollah began targeting the Free Syrian Army in the Aleppo governorate.,Kata'ib Hezbollah,Free Syrian Army
1807,all,1,493,4/1/12,"Jabhat al-Nusra (Al-Nusra) received funding and personnel from the Islamic State (which at the time operated as Al Qaeda in Iraq, or AQI) that helped establish Al-Nusra at the beginning of the Syrian conflict.",The Islamic State,Hay'at Tahrir al-Sham (Formerly Jabhat al-Nusra)
1187,riv,561,81,12/11/13,"ISIS, Al-Nusra, and Ahrar al-Sham, a member group of the Islamic Front, coordinate an attack on Hezbollah's headquarters in Damascus. Ahrar al-Sham claims to have killed over fifty Hezbollah fighters.",The Islamic Front,Hezbollah
1191,riv,1,541,1/6/14,"In early 2014, tensions on the ground between ISIS and other rebel groups begin to develop into conflict on the ground. On January 6th ISIS is driven from Raqqa after fighting with other rebel groups, including al-Nusra, members of the Islamic Front, and members of the FSA.",The Islamic State,Islamic Front
1925,all,629,81,2015-02-00,"Kataib Sayyid al-Shuhada (KSS) participated in the Assad Regimes offensive in the southern Syrian governorates, namely in Daraa and Quneitra. KSS fought alongside Assad Regime troops, Hezbollah, the Iranian Revolutionary Guard Corps and other Shiite militias against elements of the Free Syrian Army and Jabhat al-Nusra.",Kataib Sayyid al-Shuhada,Hezbollah
1915,all,545,65,2014-11-00,"When the UN sanctioned ASL in November 2014, it classified the group as an entity associated with Al Qaeda and stated that ASL is additionally associated with Al Qaeda in the Islamic Maghreb (AQIM).  According to French sources, AQIM fighters met with ASL in southern Libya, and AQIM consistently re-tweets tweets by ASL accounts on Twitter.",Ansar al-Shariah (Libya),Al Qaeda in the Islamic Maghreb
1793,spl,651,649,2/1/16,"Ajnad al-Sham's fighters in East Ghouta defected and joined Faylaq al-Rahman, a group based in the Damascus governorate and supported by former Al Qaeda affiliate Jabhat Fatah al-Sham, formerly known as Jabhat al-Nusra, amid rising tension with Jaysh al-Islam.",Faylaq al-Rahman,The Ajnad al-Sham Islamic Union
1207,spl,525,549,1/10/14,"Conflict with the Islamic State (IS) prompted Liwa Dawoud and Liwa Siyoof al-Haq, two of Suqour al-Shams strongest factions, to declare peace with IS, defect from Suqour al-Sham, and eventually form the Army of the Levant (Jaysh al-Sham) with deserting IS members.",Suqour al-Sham,Jaysh al-Sham
1787,mer,527,647,12/25/14,"The Levantine Front was founded on December 25, 2014 by the Islamic Front of Aleppo (not to be confused with the Islamic Front umbrella group), a group composed of Liwa al-Tawhid and other former Islamic Front umbrella group battalions, and four other Aleppo-based opposition groups.",Liwa al-Tawhid,The Levantine Front 
1789,spl,659,647,3/3/15,"Al-Fawj Al-Awl formed on March 3, 2015 when its 1,500 fighters broke away from Liwa al-Tawhid, a constituent brigade within the Levantine Front.",Al-Fawj Al-Awl,The Levantine Front 
1791,spl,659,647,2015-03-00,"Al-Fawj Al-Awl formed on March 3, 2015 when its 1,500 fighters broke away from Liwa al-Tawhid, a constituent brigade within the Levantine Front.",Al-Fawj Al-Awl,The Levantine Front 
1217,aff,557,21,2014-01-00,"While ABM and AQ groups share a similar ideology, they were never formal affiliates. Until Ayman Zawahiri, AQs leader, mentioned our people in the Sinai in January 2014, there had not even been confirmation that AQ recognized ABM.",The Islamic State - Sinai Province,Al Qaeda
1215,all,553,65,2012-00-00,"Boko Haram has trained alongside and received funding and other resources from Al Qaeda in the Islamic Maghreb (AQIM) since at least 2012. Many experts, however, believe that the increasing sophistication of Boko Harams activities under Shekau indicates cooperation as early as 2010.",Boko Haram,Al Qaeda in the Islamic Maghreb
1219,spl,557,21,2014-10-00,"ABMs declaration of allegiance to IS in November 2014 could indicate a split between AQ and ABM. Some ABM cells in the Nile Valley remain loyal to AQ, which could possibly divide ABM into two factions: one that remains loyal to AQ and one that is newly loyal to IS.",The Islamic State - Sinai Province,Al Qaeda
1221,all,1,559,2013-12-00,"ISIS, al-Nusra, and Ahrar al-Sham coordinate an attack on Hezbollah's headquarters in Damascus. Ahrar al-Sham claims to have killed over fifty Hezbollah fighters.",The Islamic State,Al-Nusra
1223,riv,1,559,2014-01-00,"In early 2014, tensions on the ground between ISIS and other rebel groups begin to develop into conflict on the ground. On January 6th ISIS is driven from Raqqa after fighting with other rebel groups, including al-Nusra, members of the Islamic Front, and members of the FSA",The Islamic State,Al-Nusra
