unique_id,type,group1_id,group2_id,date,description,group1_name,group2_name
741,aff,369,375,2002-00-00,Shariat Jamaat (Dagestan) and the Chechen Republic of Ichkeria were both responsible for attacks against the Russian Federation in the hopes of attaining independence. ,Chechen Republic of Ichkeria,Shariat Jamaat
747,mer,413,255,2009-00-00,"In 2009, under Doku Umarov\'s order, the Caucasus Emirate reactivated Riyadus-Salikhin, which displayed little activity after Shamil Basayev\'s (leader and founder) death in 2006.",Riyadus-Salikhin Reconnaissance and Sabotage Brigade,Caucasus Emirate
755,mer,369,255,2007-00-00,"Doku Umarov announced the end of the Chechen Republic of Ichkeria and founded a new umbrella organization, the Caucasus Emirate, to combine all of the terrorist groups in the North Caucasus. ",Chechen Republic of Ichkeria,Caucasus Emirate
751,mer,373,255,2007-00-00,"After the dissolution of the Republic of Ichkeria and the founding of the Caucasus Emirate, the Ingush Jamaat was incorporated into the Caucasus Emirate. ",Ingush Jamaat,Caucasus Emirate
1393,riv,587,25,1993-12-00,"Violent clashes between the PUK and IMK erupted in December 1993 in the Kirkuk and Sulaimaniya provinces, resulting in the withdrawal of the IMK from the region.",Patriotic Union of Kurdistan,Islamic Movement of Kurdistan
917,all,405,57,2009-00-00,"The Mahdi Army and SCIRI worked together in the lead up to the 2010 Iraqi parliamentary elections.  However, the two groups rivalry resumed shortly after the elections.",Supreme Council for Islamic Revolution in Iraq,Mahdi Army
757,mer,255,375,2007-00-00,"After the dissolution of the Republic of Ichkeria and the founding of the Caucasus Emirate, the Shariat Jamaat was incorporated into the Caucasus Emirate. ",Caucasus Emirate,Shariat Jamaat
759,mer,255,371,2007-00-00,"After the dissolution of the Republic of Ichkeria and the founding of the Caucasus Emirate, the Yarmuk Jamaat was incorporated into the Caucasus Emirate. ",Caucasus Emirate,Yarmuk Jamaat
761,mer,255,377,2007-00-00,"After the dissolution of the Republic of Ichkeria and the founding of the Caucasus Emirate, the Liberation Army of Dagestan was incorporated into the Caucasus Emirate. ",Caucasus Emirate,Liberation Army of Dagestan
763,aff,369,377,1999-00-00,Liberation Army of Dagestan and the Chechen Republic of Ichkeria were both responsible for attacks against the Russian Federation in the hopes of attaining independence. ,Chechen Republic of Ichkeria,Liberation Army of Dagestan
765,all,89,87,2015-05-00,"FARC's leader, Timonchenko, said it absolutely necessary for the ELN to join the 2015 peace talks for the sake of peace within the country.",Revolutionary Armed Forces of Colombia - People's Army,National Liberation Army (Colombia)
865,aff,403,21,1996-00-00,"SPIR received financial assistance from Al Qaeda, like other prominent terrorist groups in the North Caucasus. As a result of Al Qaeda influence, they expanded their mission from establishing an independent Chechnya to creating a North Caucasus Caliphate. ",Special Purpose Islamic Regiment,Al Qaeda
873,mer,255,373,2007-00-00,"Doku Umarov announced the end of the Chechen Republic of Ichkeria and founded a new umbrella organization, the Caucasus Emirate, to combine all of the terrorist groups in the North Caucasus. ",Caucasus Emirate,Ingush Jamaat
859,aff,369,21,1996-00-00,The Republic of Ichkeria became associated with Al Qaeda through several leaders  who participated in Al Qaeda training camps in Afghanistan. These jihadists returned to Chechnya and trained other Chechens to do the same.,Chechen Republic of Ichkeria,Al Qaeda
777,spl,223,417,1998-00-00,"Al-Badr split from Hizb-ul-Mujahideen in 1998. It is thought that the ISI instigated this split in order to separate the more violent al-Badr, made mostly of foreign mercenaries, from Hizbul-ul-Mujahideen.",Hizb-ul-Mujahideen,Al-Badr
819,aff,265,401,1979-00-00,"Al-Jama'a al-Islamiya has extensive relations with the Egyptian Islamic Jihad, dating back to the groups' foundations in after the Muslim Brotherhood renounced violence in Egypt during the 1970s. Al-Jama'a was founded as an umbrella group for what became EIJ, which emerged as a politically active student group in the 1970s and turned to violence in the early 1980s. The two groups worked together in the assassination of Anwar al-Sadat in 1981.",Al Jama' Al-Islamiya ,Egyptian Islamic Jihad
787,all,329,331,1966-00-00,"Tara and the Volunteer Force worked together until 1971. The two groups ended their relationship when Samuel McClelland (UVF), confronted William McGrath (Tara) about his alleged pedophilia and homosexuality.",Tara,Ulster Volunteer Force
791,riv,345,331,1974-05-00,"The UVF\'s Joe Shaw was killed by UDA members in a drunken brawl between the two groups. This skirmish turned into a year-long feud, which included multiple retaliatory attacks.",Ulster Defence Association,Ulster Volunteer Force
811,riv,67,73,1994-07-00,The Islamic Salvation Army (AIS) was created in response to the radical Armed Islamic Group of Algeria (GIA) (targeted civilians). ,Armed Islamic Group of Algeria,Islamic Salvation Army
837,riv,73,67,1995-03-00,Fighting increased between the two groups in 1995 (60 combined deaths in the month of march).,Islamic Salvation Army,Armed Islamic Group of Algeria
797,spl,69,65,2006-09-00,The GSPC began to encompass the ideology of global jihad in addition to their foundational goal of establishing an Islamic state in Algeria. AQIM was formed in September 2006 as part of a merger between the regional GSPC and the broader al-Qaeda movement.,Salafist Group for Preaching and Combat,Al Qaeda in the Islamic Maghreb
813,aff,71,73,1994-07-00,"During the Algerian Civil War, former MIA members joined the Islamic Salvation Army (AIS).",Armed Islamic Movement,Islamic Salvation Army
815,aff,67,427,1993-00-00,Both GIA and OJAL stemmed from the Département du Renseignement et de la Sécurité (DRS). It is believed that both were cover names for the violent actions committed by DRS.,Armed Islamic Group of Algeria,Organization of Young Free Algerians
821,all,61,19,2012-02-00,"In February 2012 Al Shabab spokesman Sheikh Raage made a specific statement that Al Shabab is connected to Al Qaeda in the Arabian Peninsula. We will work with other brothers of AQAP in Yemen, Saudi Arabia and elsewhere in the world and we are part of them. We are the branch of AQAP in Somalia.""",Al Shabaab,Al Qaeda in the Arabian Peninsula
823,aff,363,79,9/29/11,"The Network has been tied to operations with Lashkar-e-Taiba (LeT), a terrorist group also nurtured and reportedly funded by the Pakistan Inter-Service Intelligence agency (ISI). Though direct links between these two groups are not known, it is suspected that the ISI utilizes both groups to carry out terror operations in Afghanistan and Pakistan.",Haqqani Network,Lashkar-e-Taiba
825,aff,251,367,10/25/02,Jemaah Islamiyah was designated by the United Nations to the 1267 Committee\'s list of terrorist organizations linked to the Taliban.,Jemaah Islamiyah,The Taliban
1337,spl,585,577,2001-01-00,"The IUMK fragmented in 2001 when a large number of its members split off with Ali Bapir to form the Kurdistan Islamic Group and with Mullah Krekar to form the Reformist Group. Omar Barziani subsequently re-formed Kurdish Hamas with his followers, leaving Ali Abdul Aziz to re-form the IMK from the remaining members of the IUMK.",The Islamic Unity Movement of Kurdistan,The Reformist Group
831,all,409,105,2008-00-00,The IMU has maintained close ties to Tehreek-e-Taliban in Pakistan (TTP). ,Islamic Movement of Uzbekistan,Tehrik-i-Taliban Pakistan
833,aff,23,21,10/12/00,"AQY was the Yemeni branch of the al-Qaeda franchise, although they were never recognized by al-Qaeda leadership publicly.",Al Qaeda in Yemen,Al Qaeda
1365,mer,593,13,2001-12-00,"In late 2001 Jund al-Islam and the Reformist Group merged to form Ansar al-Islam, which was initially led by Mullah Krekar, the former leader of the Reformist Group.",Jund al-Islam,Ansar al-Islam
1367,mer,577,13,2001-12-00,"In late 2001 Jund al-Islam and the Reformist Group merged to form Ansar al-Islam, which was initially led by Mullah Krekar, the former leader of the Reformist Group.",The Reformist Group,Ansar al-Islam
1369,spl,405,435,2012-00-00,"In 2007, the SCIRI renamed itself the Islamic Supreme Council of Iraq (ISCI), in an attempt to disassociate itself from Tehran. To preserve ties with Iran, the Badr Organization split from the ISCI to form is own political and military unit in 2012.",Supreme Council for Islamic Revolution in Iraq,Badr Organization of Reconstruction and Development
843,aff,65,437,5/26/12,Ansar Dine is reportedly an affiliate of AQIM.  AQIM allegedly wanted to keep the affiliation secret so that Ansar Dine could expand operations without the watchful eye of the media or the international community. ,Al Qaeda in the Islamic Maghreb,Ansar Dine
863,aff,413,21,1999-00-00,"Riyadus-Salikhin had strong relationships with Al Qaeda because Shamil Basayev built a close relationship with an Al-Qaeda member, Ibn Al-Khattab, the co-founder of IIPB. Basayev received training through Al-Qaeda in Afghanistan, where he brought other Chechen recruits to receive the same training.",Riyadus-Salikhin Reconnaissance and Sabotage Brigade,Al Qaeda
847,riv,405,57,2007-08-00,"The Mahdi Army and the SCIRI's armed wing, the Badr Brigades, clashed in August of 2007 in Karbala. Over 50 shiite pilgrims were killed in the battle.",Supreme Council for Islamic Revolution in Iraq,Mahdi Army
871,spl,379,152,1991-00-00,"The Abu Sayyaf Group (ASG) was founded in 1991 by Abdurajak Abubakar Janjalani, a Moro National Liberation Front (MNLF) member who believed in a more radical way of pursuing an independent Islamic state than did the MNLF leadership. Janjalani recruited other disappointed MNLF members into what would become the ASG.",Moro National Liberation Front,Abu Sayyaf Group
853,all,369,397,10/26/02,"The Chechen Republic of Ichkeria, Riyadus-Salikhin, IIPB, and SPIR collaborated to launch an attack on the Moscow Dubrovka Theatre. They held over 800 people hostage and over 130 people were killed.",Chechen Republic of Ichkeria,International Islamic Peacekeeping Brigade
855,all,369,403,10/26/02,"The Chechen Republic of Ichkeria, Riyadus-Salikhin, IIPB, and SPIR collaborated to launch an attack on the Moscow Dubrovka Theatre. They held over 800 people hostage and over 130 people were killed.",Chechen Republic of Ichkeria,Special Purpose Islamic Regiment
857,all,369,413,10/26/02,"The Chechen Republic of Ichkeria, Riyadus-Salikhin, IIPB, and SPIR collaborated to launch an attack on the Moscow Dubrovka Theatre. They held over 800 people hostage and over 130 people were killed.",Chechen Republic of Ichkeria,Riyadus-Salikhin Reconnaissance and Sabotage Brigade
867,aff,255,21,12/27/07,"The Caucasus Emirate receives financial assistance from Al Qaeda, as well as military training. The two groups coordinate training camps in the North Caucasus and Afghanistan. ",Caucasus Emirate,Al Qaeda
869,riv,435,443,2006-00-00,"The Badr Organization, the largest Shiite party in Iraq, opposes the League of the Righteous, a group that split from the Mahdi Army. ",Badr Organization of Reconstruction and Development, League of the Righteous
875,riv,89,87,2000-01-00,"The FARC and ELN battled for local control in contested territory, namely, Antioquia through Choco.",Revolutionary Armed Forces of Colombia - People's Army,National Liberation Army (Colombia)
877,mer,255,375,2007-00-00,"Doku Umarov announced the end of the Chechen Republic of Ichkeria and founded a new umbrella organization, the Caucasus Emirate, to combine all of the terrorist groups in the North Caucasus. ",Caucasus Emirate,Shariat Jamaat
879,mer,255,371,2007-00-00,"Doku Umarov announced the end of the Chechen Republic of Ichkeria and founded a new umbrella organization, the Caucasus Emirate, to combine all of the terrorist groups in the North Caucasus. ",Caucasus Emirate,Yarmuk Jamaat
881,aff,89,87,2009-00-00,"The FARC and ELN began peace talks about a possible alliance. The two groups had been teaming up against the government until 2009, when they discussed making an official alliance.",Revolutionary Armed Forces of Colombia - People's Army,National Liberation Army (Colombia)
883,all,89,87,2009-00-00,The FARC and the ELN proposed an alliance after months jointly targeting the government. ,Revolutionary Armed Forces of Colombia - People's Army,National Liberation Army (Colombia)
885,aff,361,81,2009-00-00,"According to the U.S. government, Kata'ib Hezbollah has received money and weapons from Lebanese Hezbollah.",Kata'ib Hezbollah,Hezbollah
947,riv,147,463,1985-12-00,"SSP, an anti Shitte group, had a rival relationship with TJP, which was created to protect the interests of the Shiite in Pakistan. ",Sipah-e-Sahaba Pakistan ,Tehrik-e-Jafaria
945,spl,417,223,1998-00-00,"Al Badr, according to official sources in Jammu and Kashmir, which was earlier operating under the banner of Hizb-ul-Mujahideen (HM), was encouraged by the ISI to split off and operate independently in the year 1998",Al-Badr,Hizb-ul-Mujahideen
943,aff,417,101,1998-02-00,"While it is unclear what the extent of IJT\'s use of violent means was prior to 1971, it has been documented however that with the help of the army the IJT organized two paramilitary units, called al-Badr and al-Shams, to fight the Bengali guerrillas in the then East Pakistan.",Al-Badr,Islami-Jamiat-Taliba
941,aff,81,143,2009-04-00,"AAH received weapons, training, and financial support from Hezbollah. ",Hezbollah,Asa'ib Ahl al-Haq
939,spl,57,143,2006-07-00,The AHH is one of the faction groups of that broke away from the Madhi army during 2007-2008 infighting.,Mahdi Army,Asa'ib Ahl al-Haq
1443,riv,361,1,2014-09-00,"Kata'ib Hezbollah worked with elements of the Kurdish peshmerga to defend the city of Amerli in Iraq from IS. KH has been fighting alongside Iraqi government forces in the war against IS since June 2014. While the groups have opposed each other in Iraq, there have been no confirmed reports of KH targeting IS in Syria.",Kata'ib Hezbollah,The Islamic State
1327,spl,25,573,1997-00-00,"Hassan Sofi led a group of veterans of the Afghanistan war to split from the IMK in 1997, forming Kurdish Hamas.  Kurdish Hamas tended to be more radical Islamist and Jihadist than the IMK and sought to establish strict Shariah Law across Iraq.",Islamic Movement of Kurdistan,Kurdish Hamas
1453,mer,25,585,1999-00-00,"The Islamic Unity Movement of Kurdistan (IUMK) was a Kurdish Islamist organization formed in 1999 by the merger of the Islamic Movement of Kurdistan (IMK), al-Nahda, and Kurdish Hamas.",Islamic Movement of Kurdistan,The Islamic Unity Movement of Kurdistan
1331,mer,575,585,1999-00-00,"The Islamic Unity Movement of Kurdistan (IUMK) was a Kurdish Islamist organization formed in 1999 by the merger of the Islamic Movement of Kurdistan (IMK), al-Nahda, and Kurdish Hamas.",Al-Nahda,The Islamic Unity Movement of Kurdistan
933,all,249,361,2008-11-00,"The two groups worked together to conduct attacks on U.S. forces. Also, the groups are connected through Iranian and religious alliances. ",Promised Day Brigades,Kata'ib Hezbollah
929,all,143,249,2008-11-00,"In 2008, the two groups worked together to conduct attacks on U.S. forces. Also, the groups are connected through Iranian and religious alliances.",Asa'ib Ahl al-Haq,Promised Day Brigades
927,spl,57,249,2008-11-00,The Promised Day Brigades was created by the Mahdi Army to become its armed wing. ,Mahdi Army,Promised Day Brigades
953,aff,215,367,1996-00-00,"In the 1990s, many LeJ and SSP members fought alongside the Taliban in Afghanistan.",Lashkar-e-Jhangvi,The Taliban
955,aff,215,21,1998-00-00,"The ties forged between LeJ and Al Qaeda in the training camps of Afghanistan survived the Taliban\'s fall.  After the U.S.-led invasion of Afghanistan in 2001, LeJ members helped al Qaeda leadership escape into Pakistan and elsewhere.",Lashkar-e-Jhangvi,Al Qaeda
957,spl,215,451,2009-00-00,Lashkar-e-Jhangvi Al-Alami is a splinter of LeJ known to have carried attacks in concert with TTP against Pakistan Army and sectarian targets. ,Lashkar-e-Jhangvi,Lashkar-e-Jhangvi Al Alami
959,all,105,451,2009-00-00,TTP and LeJ-AA have carried out coordinated attacks across Pakistan.,Tehrik-i-Taliban Pakistan,Lashkar-e-Jhangvi Al Alami
961,riv,133,79,2010-04-00,Asian Tigers has openly renounced LeT for its close relationship with the ISI.,Asian Tigers,Lashkar-e-Taiba
963,riv,133,95,2010-04-00,Asian TIgers has openly renounced JeM because of its cooperative relationship with the ISI. ,Asian Tigers,Jaish-e-Mohammad
965,aff,215,95,2000-12-00,"JeM fighters have allegedly received military training in LeJ camps in Afghanistan.63 Recent cooperation between LeJ, SSP and JeM  and the trio\'s growing ties to the TTP  have led some analysts to consider the three groups (or at least some of their members) part of the Punjabi Taliban.",Lashkar-e-Jhangvi,Jaish-e-Mohammad
967,aff,301,21,2001-00-00,Wafa Humanitarian Organization has supported the Taliban and financed Al-Qaeda ,Wafa Humaniatarian Organization,Al Qaeda
969,aff,301,367,2001-00-00,Wafa Humanitarian Organization has supported the Taliban and financed Al-Qaeda. ,Wafa Humaniatarian Organization,The Taliban
971,spl,105,433,2007-12-00,"Qari Zainuddin Mehsud split from Baitullah Mehsuds Tehreek-i-Taliban-aligned group in 2007, following the death of his cousin Abdullah Mehsud.",Tehrik-i-Taliban Pakistan,Zain Group
973,aff,433,367,2009-00-00,"Zain Group has vowed support for Taliban militants in Afghanistan fighting against the US forces, particularly for Mullah Omar.",Zain Group,The Taliban
975,aff,133,217,2010-00-00,"According to Terrorism Monitor, Asian Tigers is a front of Hakat-ul-Jiahdi-Islami(HuJI), led by Ilyas Kashmiri.",Asian Tigers,Harkat-ul-Jihadi al-Islami
977,aff,133,105,2010-04-00,"According to Arif Jamal of Terrorism Monitor, Asian Tigers falls in the umbrella of Tehreek-e-Taliban(TTP) Pakistan.",Asian Tigers,Tehrik-i-Taliban Pakistan
979,all,105,411,2008-00-00,"Soon after the launch of TTP, TNSM became an important member of the TTP coalition; there was active coordination and cooperation between the two in upstaging the Pakistani state apparatus in Swat region. ",Tehrik-i-Taliban Pakistan,Tehreek Nifaz-e-Shariat Mohammadi
981,aff,411,367,2001-10-00,"TNSM actively fought alongside the Taliban against the US and Northern Alliance forces in Afghanistan sending more than 10,000 fighters into the country.",Tehreek Nifaz-e-Shariat Mohammadi,The Taliban
983,aff,449,105,2009-08-00,"After associates of Gul Bahadar and Nazir were killed in August of 2009 in territory under the control of Baitullah, Nazir demanded eight men from Baitullahs group to be handed over to his forces for their involvement in the murders. Following the non fulfillment of his demand, Maulvi Nazir separted himself from TTP.",Nazir Group,Tehrik-i-Taliban Pakistan
985,aff,425,105,2009-00-00,"According to media reports, Shadow Army and TTP have carried coordinated attacks.",Lashkar-e-Zil,Tehrik-i-Taliban Pakistan
987,aff,425,21,2009-00-00,Shadow Army consists of fighters drawn from Al-Qaeda\'s cadres.,Lashkar-e-Zil,Al Qaeda
989,aff,425,453,2009-00-00,The exact relationship between Lashkar-e-Zil and 313 Brigade is unclear; at times the two groups have been confused by analysts and reporters alike because both groups were headed by Ilyas Kashmiri.,Lashkar-e-Zil,313 Brigade
991,aff,453,105,2010-00-00,"313 Brigade is suspected to have acted in concert with TTP against a range of targets, however the extent of 313 Brigade\'s involvement remains unclear.",313 Brigade,Tehrik-i-Taliban Pakistan
993,aff,459,21,2003-06-00,Jundullah was suspected to have an affiliation with Al-Qaeda following an attack carried out by the group on Pakistan Army\'s Karachi Corps Commander. ,Jundullah,Al Qaeda
995,aff,459,21,2003-06-00,Jundullah was suspected to have an affiliation with Al-Qaeda following an attack carried out by the group on Pakistan Army's Karachi Corps Commander. ,Jundullah,Al Qaeda
997,riv,445,105,2008-00-00,LeI developed a rivalry with TTP after the killing of LeI leader Haji Namdar in 2008; TTP was suspected to have played a role in his killing.,Lashkar-e-Islam,Tehrik-i-Taliban Pakistan
999,riv,215,465,1995-00-00,"At the time of its formation, one of LeJ\'s main goal was to target and eliminate TJP cadres across Pakistan.",Lashkar-e-Jhangvi,Tehreek-e-Jafaria Pakistan
1627,spl,113,487,2010-02-00,"The Ras Kamboni Brigade, one of the original constituent groups of Hizbul Islam, began to fracture around October 2009. In February 2010, one faction of the Ras Kamboni Brigade broke away from Hizbul Islam and officially joined Al Shabaab. The other faction of the Ras Kamboni Brigade also left Hizbul Islam to form a separate group called the Ras Kamboni Movement. The Ras Kamboni Brigade ceased to exist at this time.",Hizbul Islam ,Ras Kamboni Brigade
1629,spl,113,489,2010-02-00,"The Ras Kamboni Brigade, one of the original constituent groups of Hizbul Islam, began to fracture around October 2009. In February 2010, one faction of the Ras Kamboni Brigade broke away from Hizbul Islam and officially joined Al Shabaab. The other faction of the Ras Kamboni Brigade also left Hizbul Islam to form a separate group called the Ras Kamboni Movement.",Hizbul Islam ,Ras Kamboni Movement 
1005,mer,141,491,8/20/12,"The Federal Government of Somalia was established in August 2012, following the end of the TFG\'s mandate. Internationally, it is recognized as Somalia\'s official government.",Transitional Federal Government ,Federal Government of Somalia 
1623,mer,623,487,2/4/09,"Four Somali Islamist groups merged to form Hizbul Islam. The four original groups were the Alliance for the Re-liberation of Somalia (ARS), the Ras Kamboni Brigade, Jabhatul Islamiya (Islamic Front), and Anole, also called the Anoole Forces. ",Jabhatul Islamiya,Ras Kamboni Brigade
1625,spl,113,487,2010-02-00,"The Ras Kamboni Brigade, one of the original constituent groups of Hizbul Islam, began to fracture around October 2009. In February 2010, one faction of the Ras Kamboni Brigade broke away from Hizbul Islam and officially joined Al Shabaab. The other faction of the Ras Kamboni Brigade also left Hizbul Islam to form a separate group called the Ras Kamboni Movement.",Hizbul Islam ,Ras Kamboni Brigade
1619,mer,621,625,2/4/09,"Four Somali Islamist groups merged to form Hizbul Islam. The four original groups were the Alliance for the Re-liberation of Somalia (ARS), the Ras Kamboni Brigade, Jabhatul Islamiya (Islamic Front), and Anole, also called the Anoole Forces. ",Alliance for the Re-liberation of Somalia,Anole
1621,mer,625,623,2/4/09,"Four Somali Islamist groups merged to form Hizbul Islam. The four original groups were the Alliance for the Re-liberation of Somalia (ARS), the Ras Kamboni Brigade, Jabhatul Islamiya (Islamic Front), and Anole, also called the Anoole Forces. ",Anole,Jabhatul Islamiya
1017,all,489,491,2012-09-00,"In late 2012, the Ras Kamboni Movement aligned with the Kenyan Defense Forces (KDF) and Somali forces to push Al-Shabab out of Kismayo.",Ras Kamboni Movement ,Federal Government of Somalia 
1021,aff,225,497,1997-00-00,"In their August 1997 cyber-attack, the IBT stated that they were an ‘elite department’ of the LTTE, specializing in ‘suicide e-mail bombings.’",Liberation Tigers of Tamil Elam,Internet Black Tigers
1023,spl,225,495,2004-03-00,"In March 2004, a top LTTE military commander Colonel Karuna split from the LTTE, taking around 6,000 of the LTTE\'s 15,000-strong force with him.",Liberation Tigers of Tamil Elam,Colonel Karuna Faction
1025,spl,225,499,1980-00-00,"In 1980, the ex-chairman of the LTTE, Mukundan, left LTTE to form PLOTE after a rivalry with LTTE\'s founder Prabhakaran.",Liberation Tigers of Tamil Elam,People's Liberation Organization of Tamil Eelam
1027,all,501,495,2004-04-00,"Colonel Karuna allies himself with the Indian-based ENDLF, who help him form the political wing of his faction: Tamil Makkal Viduthalai Pulikal (TVMP). ",Eelam National Democratic Liberation Front,Colonel Karuna Faction
1029,riv,503,225,1986-04-00,"In April, the LTTE launched an all-out offensive against the TELO, killing most of their members. In May, the LTTE successfully killed TELO\'s leader, Sri Sabaratnam.",Tamil Eelam Liberation Organization ,Liberation Tigers of Tamil Elam
1031,spl,499,501,1987-00-00,"Gnanapiragasam Gnanasekaran, a former leader of PLOTE, merged his Three Stars militant group with another PLOTE splinter group led by Jotheeswaran and an EPRLF splinter group led by Douglas Devananda to form the Eelam National Democratic Liberation Front (ENDLF) ",People's Liberation Organization of Tamil Eelam,Eelam National Democratic Liberation Front
1033,spl,505,501,1987-00-00,"In 1987, the faction of the EPRLF led by Douglas Devananda splits from the EPRLF to form the Eelam National Democratic Liberation Front (ENDLF) along with a faction of PLOTE.",Eelam People's Revolutionary Liberation Front,Eelam National Democratic Liberation Front
1035,riv,505,225,12/13/86,"In December 1986, the LTTE launches an all-out assault on EPRLF bases in Jaffna, defeating the group militarily by early 1987. After these attacks, the group disbands and becomes a political party, backed by the Indian Peacekeeping Force (IPKF).",Eelam People's Revolutionary Liberation Front,Liberation Tigers of Tamil Elam
1037,all,499,509,1987-00-00,"In 1987, PLOTE accepted the Indo-Sri Lankan Accord and has since fought alongside government forces against the LTTE.",People's Liberation Organization of Tamil Eelam,Democratic Socialist Republic of Sri Lanka 
